{
  "schema_version": 1,
  "as_of": "2026-10-04",
  "major": 11,
  "status": "supported",
  "status_src": {
    "url": "https://updates.drupal.org/release-history/drupal/current",
    "verified": true,
    "checked_at": "2026-10-04",
    "note": "supported_branches lists 11.3., 11.4. and 11.5."
  },
  "released": {
    "planned": null,
    "actual": "2024-08-02",
    "src": "https://www.drupal.org/api-d7/node.json?nid=3465378 (drupal 11.0.0)",
    "verified": true
  },
  "eol": {
    "date": null,
    "text": "mid-late 2028, at least until the release of Drupal 13",
    "src": "https://www.drupal.org/about/core/blog/announcing-drupal-1200-platform-requirements (02-F1, read 2026-10-03)",
    "verified": true
  },
  "upgrade_from_min": {
    "value": "10.3",
    "src": "https://www.drupal.org/api-d7/node.json?nid=3465378 (drupal 11.0.0 release notes: sites must update to Drupal 10.3 before updating to Drupal 11)",
    "verified": true
  },
  "ddev_type": "drupal11",
  "composer_stability_while_prerelease": null,
  "toolchain_cell": "11",
  "php_defaults": {
    "env": "8.3",
    "tab": "8.4"
  },
  "default_ranges": {
    "target-only": "^11",
    "keep-previous": "^10 || ^11",
    "widest": "^10 || ^11"
  },
  "minors": {
    "11.0": {
      "latest": "11.0.13",
      "released": "2024-08-02",
      "php_min": "8.3",
      "php_recommended": "8.3",
      "php_supported": null,
      "php_unsupported": null,
      "symfony_major": 7,
      "twig_major": 3,
      "phpunit_constraint": "^10.5.19",
      "coder_constraint": "^8.3.10",
      "phpstan_constraint": "^1.11.0",
      "phpstan_drupal_constraint": "^1.2.10",
      "polyfills": [],
      "src": "https://git.drupalcode.org/project/drupal/-/raw/11.0.13/{core/composer.json,composer/Metapackage/DevDependencies/composer.json,core/lib/Drupal.php} ; https://repo.packagist.org/p2/drupal/core.json",
      "php_src": null,
      "verified": true,
      "checked_at": "2026-10-04"
    },
    "11.1": {
      "latest": "11.1.10",
      "released": "2024-12-13",
      "php_min": "8.3",
      "php_recommended": "8.3",
      "php_supported": [
        "8.3",
        "8.4"
      ],
      "php_unsupported": [
        "8.1",
        "8.2",
        "8.5",
        "8.6"
      ],
      "symfony_major": 7,
      "twig_major": 3,
      "phpunit_constraint": "^10.5.19",
      "coder_constraint": "^8.3.10",
      "phpstan_constraint": "^1.12.4",
      "phpstan_drupal_constraint": "^1.2.11",
      "polyfills": [],
      "src": "https://git.drupalcode.org/project/drupal/-/raw/11.1.10/{core/composer.json,composer/Metapackage/DevDependencies/composer.json,core/lib/Drupal.php} ; https://repo.packagist.org/p2/drupal/core.json",
      "php_src": "https://www.drupal.org/api-d7/node.json?nid=2891690 (PHP requirements, changed 2026-08-04)",
      "verified": true,
      "checked_at": "2026-10-04"
    },
    "11.2": {
      "latest": "11.2.14",
      "released": "2025-06-19",
      "php_min": "8.3",
      "php_recommended": "8.3",
      "php_supported": [
        "8.3",
        "8.4"
      ],
      "php_unsupported": [
        "8.1",
        "8.2",
        "8.5",
        "8.6"
      ],
      "symfony_major": 7,
      "twig_major": 3,
      "phpunit_constraint": "^10.5.19 || ^11.5.3",
      "coder_constraint": "^8.3.30",
      "phpstan_constraint": "^1.12.27 || ^2.1.17",
      "phpstan_drupal_constraint": "^1.3.9 || ^2.0.7",
      "polyfills": [
        "symfony/polyfill-php84"
      ],
      "src": "https://git.drupalcode.org/project/drupal/-/raw/11.2.14/{core/composer.json,composer/Metapackage/DevDependencies/composer.json,core/lib/Drupal.php} ; https://repo.packagist.org/p2/drupal/core.json",
      "php_src": "https://www.drupal.org/api-d7/node.json?nid=2891690 (PHP requirements, changed 2026-08-04)",
      "verified": true,
      "checked_at": "2026-10-04"
    },
    "11.3": {
      "latest": "11.3.18",
      "released": "2025-12-17",
      "php_min": "8.3",
      "php_recommended": "8.4",
      "php_supported": [
        "8.3",
        "8.4",
        "8.5"
      ],
      "php_unsupported": [
        "8.1",
        "8.2",
        "8.6"
      ],
      "symfony_major": 7,
      "twig_major": 3,
      "phpunit_constraint": "^11.5.50",
      "coder_constraint": "^8.3.30",
      "phpstan_constraint": "^1.12.27 || ^2.1.26",
      "phpstan_drupal_constraint": "^1.3.9 || ^2.0.9",
      "polyfills": [
        "symfony/polyfill-php84",
        "symfony/polyfill-php85"
      ],
      "src": "https://git.drupalcode.org/project/drupal/-/raw/11.3.18/{core/composer.json,composer/Metapackage/DevDependencies/composer.json,core/lib/Drupal.php} ; https://repo.packagist.org/p2/drupal/core.json",
      "php_src": "https://www.drupal.org/api-d7/node.json?nid=2891690 (PHP requirements, changed 2026-08-04)",
      "verified": true,
      "checked_at": "2026-10-04"
    },
    "11.4": {
      "latest": "11.4.8",
      "released": "2026-07-01",
      "php_min": "8.3",
      "php_recommended": "8.4",
      "php_supported": [
        "8.3",
        "8.4",
        "8.5"
      ],
      "php_unsupported": [
        "8.1",
        "8.2"
      ],
      "symfony_major": 7,
      "twig_major": 3,
      "phpunit_constraint": "^11.5.50",
      "coder_constraint": "^8.3.30",
      "phpstan_constraint": "^1.12.27 || ^2.2.0",
      "phpstan_drupal_constraint": "^1.3.9 || ^2.0.15",
      "polyfills": [
        "symfony/polyfill-php84",
        "symfony/polyfill-php85",
        "symfony/polyfill-php86"
      ],
      "src": "https://git.drupalcode.org/project/drupal/-/raw/11.4.8/{core/composer.json,composer/Metapackage/DevDependencies/composer.json,core/lib/Drupal.php} ; https://repo.packagist.org/p2/drupal/core.json",
      "php_src": "https://www.drupal.org/api-d7/node.json?nid=2891690 (PHP requirements, changed 2026-08-04)",
      "verified": true,
      "checked_at": "2026-10-04"
    },
    "11.5": {
      "status": "detect",
      "note": "Ships the week of 2026-12-07 with 12.0.0; refresh-data.sh fills it from its first tag."
    }
  },
  "removed_extensions": [
    {
      "name": "action",
      "kind": "module",
      "removed_in": "11.0",
      "deprecated_in": "10.3.0",
      "replacement_project": "action",
      "rewrite": "dependency",
      "src": "https://www.drupal.org/api-d7/node.json?nid=3223395 (Deprecated and obsolete extensions) ; core tree: present at 10.6.18, absent at 11.0.0 (https://git.drupalcode.org/project/drupal/-/tree/11.0.0/core/modules)",
      "verified": true,
      "verified_at": "11.0.0",
      "note": "Actions UI."
    },
    {
      "name": "book",
      "kind": "module",
      "removed_in": "11.0",
      "deprecated_in": null,
      "replacement_project": "book",
      "rewrite": "dependency",
      "src": "https://www.drupal.org/api-d7/node.json?nid=3223395 (Deprecated and obsolete extensions) ; core tree: present at 10.6.18, absent at 11.0.0 (https://git.drupalcode.org/project/drupal/-/tree/11.0.0/core/modules)",
      "verified": true,
      "verified_at": "11.0.0",
      "note": "The page says: deprecated in Drupal 10."
    },
    {
      "name": "forum",
      "kind": "module",
      "removed_in": "11.0",
      "deprecated_in": null,
      "replacement_project": "forum",
      "rewrite": "dependency",
      "src": "https://www.drupal.org/api-d7/node.json?nid=3223395 (Deprecated and obsolete extensions) ; core tree: present at 10.6.18, absent at 11.0.0 (https://git.drupalcode.org/project/drupal/-/tree/11.0.0/core/modules)",
      "verified": true,
      "verified_at": "11.0.0",
      "note": "The page says: deprecated in Drupal 10."
    },
    {
      "name": "statistics",
      "kind": "module",
      "removed_in": "11.0",
      "deprecated_in": null,
      "replacement_project": "statistics",
      "rewrite": "dependency",
      "src": "https://www.drupal.org/api-d7/node.json?nid=3223395 (Deprecated and obsolete extensions) ; core tree: present at 10.6.18, absent at 11.0.0 (https://git.drupalcode.org/project/drupal/-/tree/11.0.0/core/modules)",
      "verified": true,
      "verified_at": "11.0.0",
      "note": "The page says: deprecated in Drupal 10."
    },
    {
      "name": "tour",
      "kind": "module",
      "removed_in": "11.0",
      "deprecated_in": null,
      "replacement_project": "tour",
      "rewrite": "dependency",
      "src": "https://www.drupal.org/api-d7/node.json?nid=3223395 (Deprecated and obsolete extensions) ; core tree: present at 10.6.18, absent at 11.0.0 (https://git.drupalcode.org/project/drupal/-/tree/11.0.0/core/modules)",
      "verified": true,
      "verified_at": "11.0.0",
      "note": "The page says: deprecated in Drupal 10."
    },
    {
      "name": "tracker",
      "kind": "module",
      "removed_in": "11.0",
      "deprecated_in": "10.1.0",
      "replacement_project": "tracker",
      "rewrite": "dependency",
      "src": "https://www.drupal.org/api-d7/node.json?nid=3223395 (Deprecated and obsolete extensions) ; core tree: present at 10.6.18, absent at 11.0.0 (https://git.drupalcode.org/project/drupal/-/tree/11.0.0/core/modules)",
      "verified": true,
      "verified_at": "11.0.0",
      "note": "Activity Tracker."
    },
    {
      "name": "help_topics",
      "kind": "module",
      "removed_in": "11.0",
      "deprecated_in": null,
      "replacement_project": null,
      "rewrite": "hard-break",
      "src": "https://www.drupal.org/api-d7/node.json?nid=3223395 (Deprecated and obsolete extensions) ; core tree: present at 10.6.18 (lifecycle: deprecated), absent at 11.0.0 (https://git.drupalcode.org/project/drupal/-/tree/11.0.0/core/modules)",
      "verified": true,
      "verified_at": "11.0.0",
      "note": "Its functionality moved into the help module in 10.2.0; the page calls it an obsolete, empty stub since before 11.0.0. A dependency on it is dropped, not replaced."
    }
  ],
  "removed_libraries": [
    {
      "name": "core/css.escape",
      "removed_in": "11.0",
      "deprecated_in": "10.0.0",